{
  "schema_version": 1,
  "captured_at_utc": "2026-09-01T03:16:07.5502676+00:00",
  "evidence_kind": "sanitized_raw_snapshot",
  "scope": {
    "system": "Local Dify 1.16.1 Published Service API streaming workflow",
    "experiment": "Experiment-only exact prefork pool-child loss under task-scoped late ACK and reject_on_worker_lost",
    "fault_scope": "One revalidated prefork child_host_pid only",
    "fault_injected_in_valid_attempt": true,
    "controller_or_container_killed": false
  },
  "evidence_window": {
    "baseline_capture_utc": "2026-09-01T10:28:25.058479+08:00",
    "valid_attempt_started_utc": "2026-09-01T10:59:10.718814+08:00",
    "valid_attempt_final_capture_utc": "2026-09-01T11:01:15.180889+08:00",
    "post_fault_runtime_capture_utc": "2026-09-01T11:03:34.716365+08:00",
    "rollback_runtime_capture_utc": "2026-09-01T11:08:37.309718+08:00",
    "post_rollback_state_capture_utc": "2026-09-01T11:09:53.932772+08:00",
    "final_host_observation_utc": "2026-09-01T03:14:49.7087184+00:00"
  },
  "provenance": {
    "source_artifact_manifest": "evidence/dify-prefork-child-loss-manifest.json",
    "source_artifact_manifest_sha256": "8fa170000f21c17e388b90854ec1e9ff316bc8b05b746800e5ad20758b0e9300",
    "ignored_artifact_root": "_dify_bench/published-20260828/prefork-child-loss-20260901",
    "credential_handling": "Tracked evidence omits the Published App token, Authorization headers, passwords, cookies, full service environments, bootstrap credentials, and raw SSE bodies. Runtime environment fields are allowlisted; payloads and rendered Compose content are represented by hashes where appropriate.",
    "portable_clone_boundary": "The ignored source artifacts remain local. A clone receives this sanitized transcription and the path/hash/size manifest, not the ignored artifacts themselves."
  },
  "environment": {
    "dify_version": "1.16.1",
    "deployment": "Docker Compose in dedicated WSL distribution DifyBench-Isolated-20260828",
    "compose_project": "dify_pub_20260828",
    "runtime_image": "langgenius/dify-api:1.16.1",
    "runtime_image_id": "sha256:48295be2027d55f7791231c32b1e585a03eed42e3f88d014ae39ee15eb6362cb",
    "semantic_source_checkout_commit": "5456d4d56e5701999bc8da2a2c97f5ae9b3b78d3",
    "semantic_source_checkout_role": "semantic_reference_not_runtime_byte_identity",
    "wsl_boot_id": "fa91dc2b-8dcf-4d25-a9ae-66cb934b009d",
    "compose_default_network_id": "b346a4c948eae36bf56713e561041889d1ddfeb62e05f19679fd71cdd1e1febe",
    "models_or_external_api_keys_required": false,
    "preflight_observations": {
      "only_isolated_distribution_started": true,
      "ubuntu_distribution_remained_stopped": true,
      "bridge_rule_present": true,
      "cross_container_redis_ping": "PONG",
      "api_health": "healthy",
      "worker_ready": true,
      "sink_health": "ok",
      "observation_grade": "Operator terminal preflight; the runtime and state captures provide the structured configuration, process, and broker evidence."
    }
  },
  "baseline": {
    "compose_files": [
      "[REDACTED_LOCAL_PATH:base_compose]"
    ],
    "api_and_worker_effective": {
      "task_acks_late": false,
      "task_reject_on_worker_lost": false,
      "broker_transport_options": {},
      "result_backend_transport_options": {},
      "global_visibility_timeout": null,
      "live_redis_channel_visibility_timeout": 3600
    },
    "worker": {
      "pool": "celery.concurrency.gevent:TaskPool",
      "max_concurrency": 4,
      "prefetch_count": 4,
      "direct_os_child_count": 0,
      "restart_count": 0
    },
    "redis_queue_unacked_index": [
      0,
      0,
      0
    ]
  },
  "experimental_runtime": {
    "compose_files": [
      "[REDACTED_LOCAL_PATH:base_compose]",
      "[REDACTED_LOCAL_PATH:experiment_overlay]"
    ],
    "mounted_services": [
      "api",
      "api_websocket",
      "worker",
      "worker_beat"
    ],
    "overlay_mounts_per_service": 1,
    "overlay_mount_read_only": true,
    "overlay_ext_celery_sha256": "6ec8bfb1f47be09efda9d1c6dcef0e3e17f8706e5d5c4007432f75e98931ddcc",
    "compose_override_sha256": "14160cebbafc3c2ab9661b69bb737b5d687fc22870854feed32e71b4ba3ee65c",
    "api_and_worker_exact_task_effective": {
      "task_name": "tasks.app_generate.workflow_execute_task.workflow_based_app_execution_task",
      "task_acks_late": true,
      "task_reject_on_worker_lost": true,
      "task_acks_on_failure_or_timeout": true,
      "task_ignore_result": true,
      "broker_transport_visibility_timeout": 900,
      "result_backend_visibility_timeout": 900,
      "global_visibility_timeout": 900,
      "live_redis_channel_visibility_timeout": 900
    },
    "worker": {
      "pool": "celery.concurrency.prefork:TaskPool",
      "max_concurrency": 1,
      "prefetch_count": 1,
      "controller_container_pid": 1,
      "restart_count": 0
    },
    "service_container_ids": {
      "api": "d4b36e07024c876d9caedcea053220cd47983ff04bdd1464a34d85fc3c374e8b",
      "api_websocket": "304c88df9d7fa1134d1b681604d62aed9804d6be35e5ff1cc564e9c2c068141a",
      "worker": "251af070b3c45b2c7d28b928c0047769cb0235e38143908ae2cbbda39024455a",
      "worker_beat": "e80068bbaa5ad256a3a05f20a7c0e892a1f08f0f63d916d525145b53b536ae81"
    },
    "stable_pre_request_topology": {
      "snapshot_count": 2,
      "first_capture_started_utc": "2026-09-01T10:46:10.047105+08:00",
      "second_capture_finished_utc": "2026-09-01T10:47:41.336436+08:00",
      "worker_container_id": "251af070b3c45b2c7d28b928c0047769cb0235e38143908ae2cbbda39024455a",
      "parent": {
        "container_pid": 1,
        "host_pid": 39146,
        "host_start_ticks": 106732
      },
      "only_direct_child": {
        "container_pid": 147,
        "host_pid": 40391,
        "host_start_ticks": 109520
      },
      "pool_processes": [
        147
      ],
      "prefork_topology_pass_in_both": true,
      "identity_note": "This stable no-request child later completed an invalid normal cleanup and was naturally replaced. It was not the fault target and must never be reused as a future PID."
    },
    "same_runtime_after_fault_before_rollback": true
  },
  "invalidated_attempts": [
    {
      "attempt": "fault-001",
      "input_key": "pub-prefork-child-loss-20260901-001",
      "classification": "invalid_no_request",
      "fault_injected": false,
      "release_created": false,
      "request_launched": false,
      "reason": "The requested client container name collided with a retained exited container before any workflow request, run, effect, or fault action. No key was consumed by Dify and no kill occurred."
    },
    {
      "attempt": "child-loss-fault-001",
      "input_key": "pub-prefork-child-loss-20260901-001",
      "workflow_run_id": "f51411e2-0ccd-4454-80d9-6ebacec0326e",
      "celery_task_id": "aee2eb54-4e69-4e75-9567-c94712cd23dd",
      "classification": "invalid_no_kill",
      "failure_class": "helper_overconstrained_initial_redis_redelivered_field",
      "fault_injected": false,
      "reason": "Active inspect correctly reported redelivered=false while the initial decoded Redis delivery field was null. The first helper incorrectly required the Redis field itself to be false and failed closed before kill.",
      "cleanup": {
        "emergency_release_created": true,
        "workflow_status": "succeeded",
        "total_steps": 3,
        "effect_attempts": [
          1
        ],
        "active_task_count": 0,
        "redis_queue_unacked_index": [
          0,
          0,
          0
        ],
        "same_child_continuity": true
      },
      "repair": "The valid helper revision accepts null or false for the initial Redis delivery field while still requiring explicit true on the recovery delivery."
    }
  ],
  "valid_attempt": {
    "attempt": "child-loss-fault-002",
    "classification": "valid_prefork_child_loss_redelivery_duplicate_recovered",
    "input_key": "pub-prefork-child-loss-20260901-002",
    "workflow_run_id": "55cb064a-3558-4284-a6ae-572b74fcaf20",
    "celery_task_id": "e90f7d70-774f-4a42-a87a-a6b552e28e45",
    "initial_delivery_tag": "8e69a6e0-eadc-4b22-b145-edef3821c628",
    "blocked_attribution": {
      "capture_started_at_utc": "2026-09-01T10:59:35.679768+08:00",
      "capture_finished_at_utc": "2026-09-01T10:59:58.058015+08:00",
      "workflow_status": "running",
      "node_statuses": {
        "start": "succeeded",
        "effect": "running"
      },
      "sink": {
        "attempt_1_fsynced": true,
        "attempt_1_applied_at_epoch": 1788231575.6977446,
        "marker_exists": true,
        "release_exists": false
      },
      "active_task": {
        "count": 1,
        "worker_pid": 1218,
        "acknowledged": false,
        "redelivered": false,
        "task_name_matches": true,
        "workflow_run_id_matches": true,
        "input_key_matches": true,
        "response_mode": "streaming"
      },
      "redis": {
        "atomic_and_consistent": true,
        "queue_len": 0,
        "unacked_hlen": 1,
        "unacked_index_zcard": 1,
        "target_delivery_count": 1,
        "task_id": "e90f7d70-774f-4a42-a87a-a6b552e28e45",
        "delivery_tag": "8e69a6e0-eadc-4b22-b145-edef3821c628",
        "redelivered_field": null,
        "score_epoch": 1788231575.4850268,
        "visibility_due_epoch": 1788232475.4850268
      },
      "worker_container": {
        "id": "251af070b3c45b2c7d28b928c0047769cb0235e38143908ae2cbbda39024455a",
        "restart_count": 0
      },
      "parent": {
        "container_pid": 1,
        "host_pid": 39146,
        "host_ppid": 39102,
        "host_start_ticks": 106732
      },
      "fault_target_child": {
        "container_pid": 1218,
        "host_pid": 76915,
        "host_ppid": 39146,
        "host_start_ticks": 205391
      },
      "pool_processes": [
        1218
      ],
      "all_attribution_gates_passed": true
    },
    "immediate_pre_kill_recapture": {